{"core_statement":"These systems are not competitors on one compression axis. They remove waste from different operational surfaces.","entries":[{"combination_position":"may precede output/handoff and V13 governance","preserved_boundary":"necessary tool result and evidence","proposed_removal_boundary":"unnecessary payload after tool execution","surface":"tool-output surface","system":"RTK","verification_status":"LATER_WEB_VERIFICATION_REQUIRED"},{"combination_position":"may coexist with instruction and output reduction","preserved_boundary":"specified contracts and behavior","proposed_removal_boundary":"unnecessary implementation bulk or repetition","surface":"implementation surface","system":"Ponytail","verification_status":"LATER_WEB_VERIFICATION_REQUIRED"},{"combination_position":"may feed output/handoff and V13 governance","preserved_boundary":"mandatory instructions and recallability","proposed_removal_boundary":"always-loaded instruction burden or duplication","surface":"persistent-instruction surface","system":"Compactor","verification_status":"LATER_WEB_VERIFICATION_REQUIRED"},{"combination_position":"may sit downstream of other reductions","preserved_boundary":"restart state and actionable evidence","proposed_removal_boundary":"repetitive or non-actionable output and handoff material","surface":"output / handoff surface","system":"OSI","verification_status":"LATER_WEB_VERIFICATION_REQUIRED"},{"combination_position":"may govern compatible combinations across surfaces","preserved_boundary":"human Seat, evidence, rollback, and re-entry capacity","proposed_removal_boundary":"unnecessary or unauthorized repeated loops and ambiguous authority transitions","surface":"iteration / authority surface","system":"V13","verification_status":"INTERNAL_POSITIONING_STATEMENT"}],"rules":["Higher percentage does not imply cross-layer superiority.","Combinations are allowed only when preserved boundaries remain compatible.","No external performance number is included.","Cross-layer ranking and superiority claims are prohibited."],"schema":"decision-os.reduction-boundary-map.v0.1"}
